good_type,tags
Accs,качественный пошив; приятная текстура; без uv-защиты; бесформенная; белоснежный; насыщенный цвет; блестящий; большой электронный циферблат; эргономичные наушники; прочный; светостойкий; устойчивость к стирке; выцветает при намокании; вязаные изделия; кожа; глубокая форма; двухсторонний; широкий подворот; сохраняет форму; дешёвый; для тонких волос; долговечный; мало отверстий; дышащий; с вышивкой; карманные для карточек; салфетка в комплекте; шерсть; специальная нить для тачскрина; жесткие зоны; шарф-маска; замша/велюр; запах материала; защита глаз; солнцезащита; подарочный вариант; удобно сидит; изящный дизайн; серебряная фурнитура; пластик; яркий принт; форма оправы; черно-коричневый; фирменная упаковка; оригинальный дизайн; лаконичный дизайн; легкий; летняя коллекция; легко ломается; маркий материал; минималистичный; мягкий; тактильно приятный; натуральный материал; комфортная посадка; надежная; невесомый; нежный дизайн; неоднородная фактура; объемный; следы на переносице; кнопка с фиксатором; удобные крепления; отображение даты; переливающаяся надпись; плотный материал; плотное прилегание; поляризация; точное лекало; пылесборник; растягивается; эластичная регулируемая резинка; стильный дизайн; стирающиеся очки; темный цвет; тёплый; тонкий; тяжелые; узкая оправа; флисовый; хлопок; хрупкий механизм; стойкая окраска; шелковая отделка; эластичные; элегантный; эффектный дизайн; яркий кристалл; асимметричные; бордовый цвет; весенняя; вместительная; водонепроницаемые; выцвела; гематит; гипоаллергенный сплав; глаза устают меньше; гнётся; демисезонный; детская; дизайн 90-х; для легких тканей; для межсезонья; для минимума вещей; есть в 5 цветах; есть секундомер; есть футляр; классика жанра; классика с электроникой; козырёк вшит в сетку; косые; красная вставка; крепкая; крупное лого; лейбл; малая вместимость; массивные; махровая прослойка; медведь; металлический логотип; механический; милая; много отверстий; можно как браслет; молодежная; молочный оттенок; мужской стиль; нарядные; не пропускают воду; немного электризуется; носить в два слоя; облегающие; обтягивает голову; полумесяц козырек; помогают при работе за компом; проветривание кожи головы; просвечивают; пухообразование; пушистая; работают с телефоном; розовые стекла; садится после стирки; сенсорные пальчики; сертификат подлинности; силиконовый; сильный чокер; сияет; скольжение; слайдер ремешка; слегка мнётся; сложный перевод стрелок; совместим с оригиналами; спасает от пота; текстиль под замшу; трендовый цвет; треугольный ворот; туговато на 2 оборота; уплотненная лобная зона; устойчивость формы; уши наполовину открыты; фиолетовый подтон; цвет: темный шоколад; цветное напыление; шероховатость внутри; шнуровка; эргономичная; яркая нашивка
Bags,два ремня; запах; аккуратный пошив; фирменная упаковка; ровные швы; ремень; качественная фурнитура; бахрома; брак возможен; без внутренних отделений; отсутствие карманов; наличие пыльника; болотно-коричневый; объемный; карманы разного типа; брак фурнитуры; для ключей и телефона; с защитной пленкой; сезонные цвета; качественная внутренняя отделка; отсеки для мелочей; вместительная; внутренняя подкладка; водоотталкивающий материал; прочная цепочка; высококачественные материалы; подкладка; гладкая кожа; грубая; кожа; с отделениями; подарочная сумка; держит форму; детская; дефект материала; зимний; картхолдер; летняя; минимализм; долговечный; ежедневное; вмятины возможны; с царапинами; функциональные ножки; пыльник для сумок; неаккуратный вид; металлический замок; желтоватый; жесткая конструкция; проблемы с застежкой; магнитная застежка; заломы кожи; сломанный замок; плащевка; текстура; надежные молнии; классика; мягкий; конструкция лямок; повреждение поверхности; прочный; кривой пошив; лаконичная; липнет при ношении; пыль пристает; неудобное крепление; удобная конструкция; можно стирать; холодный молочный; усиленная спинка; замок на отделении; на плечо; на поясе; нарядная сумка; не маркий; низкое качество; слабые крепления; непромокаемый; регулируемая лямка; торчащие нитки; ограниченная вместимость; функциональные отсеки; отдел под гаджеты; органайзер для сумки; пластмассовая пряжка; плотный материал; повреждение при доставке; совместимость с телефоном; проблемы с застежкой; складной; водные пятна; трансформер; с аксессуарами; узкая с узором; сделано в китае; серо-оливковый; скрип материала; минималистичная; спортивный стиль; темно-шоколадный; тонкий ремень; тяжелая; цепь; удобная конструкция; цвет: розово-черный; черный; экокожа; бархатистая; бюджетный; вечерняя; двухсторонняя; для девочки 10 лет; для ноутбука 17; для ручной клади; достойный вид издали; есть резинка сзади; загрязнена при получении; заменитель кожи; замша; застёжка-липучка; застёжки с двух сторон; золотая отделка; кабель-менеджмент; канареечного цвета; катышится; качественный деним; китайское производство; клея не видно; кожзам; колется; комфортное распределение нагрузки; кошелек-брелок; края обработаны; крепление ремешка слабое; кривовата; крошится ремешок; крючок легко открывается; лаковое покрытие; линяет при намокании; логотип стирается; маркая; матовые элементы; металлический карабин; милая; много ниш; может оставлять налет; можно как украшение; молния барахлит; на повседневку; набита бумагой; наклейка лейбл; насос в комплекте; не баул; не вмещает большой кошелек; нежно розовая; некачественно пришита; немаркий; необычная; неполная окраска; нет крепления для ноутбука; нет секции для монет; ноская; обтерся шильдик; открепляемая часть; отсутствие страз; перегородка для ноутбука; перекошена; перламутровый; перфорация; под куртку; подходит к любой одежде; полиуретан; потемнения подкладки; потертости покрытия; потрескалась; похожа на тряпку; пришла помятой; приятный чехол; продуманные секции; прорезиненный слой; простая; проходит проверку; пудровый цвет; рабочий чип; растягивается; ручка наклоняет сумку; ручка через голову; рыжий цвет; секретные отделы; серебристый замок; скольжение лямок; смотришься хорошо; соломенная; сомнения в качестве; спицы внутри; сравнима с итальянскими; средняя жесткость; странные затяжки; сужается к верху; тиснение; три варианта носки; три вида ремней; углы букв задираются; унисекс; фактически 2 сумки; формат а4; хлопковая; хороший принт; цвет конька; чёткие линии; широкое открытие
Beauty_Accs,"высокий spf; содержит спирт; фруктовый вкус; аромат розы и трав; без запаха; базовый крем; бальзам с оттенком и уходом; для всех типов кожи; бархатный эффект; коричневый; гипоаллергенный; дозатор; без рыжины; для чувствительных зон; отбеливание зубов; эффективное очищение; мягкий пилинг; уход за волосами; блеск; с блестками; объем; уровень расхода; для проблемной кожи; пенится; бюджетный; заметный эффект; разные эффекты; консистенция; плотность; долгая чистота волос; восстанавливающий; уход за губами; напитывающий; временный; выгодные комплекты; контроль пигментации; выравнивает тон кожи; устраняет пятна; гелевая текстура; сушащий гель; гладкость кожи; густой гель; сияние; мягкость кожи; перелив; фиксация прически; длительного действия; долго держится; свежесть; гибкая фиксация; долговременный эффект; для волос и бровей; для всей семьи; для домашнего ухода; антиакне; освежающее увлажнение; натуральный эффект; пастельный оттенок; разные варианты; осветление кожи; разная жесткость; жидковатый; жирноватая формула; многоуровневая защита; защита от солнца; защитный колпачок; средство для удаления скаток; компактный размер; комфортный; хорошая фиксация; неприятный запах со временем; многослойное нанесение; проблемы с крышкой; легкий; нежная пена; легко использовать; портативный; сияющий; липкий; лифтинг-эффект; очищение лица; неровное нанесение; равномерное нанесение; формула; регулируемое покрытие; насыщенный черный; маскирует покраснения; матовый; мелкий помол; мягкий ментол; светлеющий со временем; миниатюрный; увлажняющая сыворотка; подсушка с подсветкой; мятный вкус; эргономичная ручка; слабый шлейф; хорошая пигментация; недостаточная защита от пота; неустойчив к жаре; компактно складывается; после депиляции; нержавеющий; нежирный; нежная текстура; нейтральные; дискомфорт при использовании; несмываемое средство; ночное восстановление; средняя жесткость; оранжевый оттенок; оригинальный; основа под макияж; хорошая кисточка; мягкое отшелушивание; охлаждает лицо; питание; повторная покупка; подарочные наборы; объемные ресницы; под цвет кожи; совместимость с тональным кремом; эффективный ретинол; полировка зубов; прозрачный; ровный загар; антиперхоть; приятный цвет; удобный в использовании; разглаживает морщины; резкий аромат; срок годности до 2027; салонный эффект; самостоятельное средство; силиконовая; высокая стойкость; эффективный скраб; снимает отеки; совместим с косметикой; воск и гранулы; для блонд волос; специфические ощущения; долгостойкий; сужение пор; сухой; термозащита; тонизирующий тоник; тревел-формат; тяжелый; укладка волос; унисекс аромат; раздражение кожи головы; чистая кожа; шелковистость; шершавость кожи; щиплющее ощущение; экономичная; усиление эффекта; агрессивный состав; аккуратное распутывание; антиперспирант; аромат cherry; базовая тушь; базовое действие; бережное к деснам; берет много продукта; ванильный акцент; временный эффект; глубокий цвет; готический дизайн; дезодорирует; детская; для пористых кудрявых; долговечная; дорого; есть вмятины; жжение языка; жжёт; запах манго; запах табака и сандала; зимний уход; из франции; классический красный; кондиционер; концентрат; крошащаяся пемза; крошится; лак; лаковый финиш; легко контролировать расход; лечит трещины; ложится как вторая кожа; матовый мусс; менее выпадают; микротоки; минимальный аромат; мицеллярная вода; многофункциональные; может оставлять налет; мягкий грифель; на магните; наносится дважды; недорогой; нейтрализует желтизну; неприятная после мойки; нерастворимые частички; несмотря на защиту, появляются черные точки; нужны перчатки; оставляет следы; острая; отпечатывается на веке; парфюмированный; плешивят; плохо покрывает за 1 слой; полноразмерный повтор; порошок; поры стали меньше; пощипывает при первом использовании; практичная; преображающая; при розацеа; пыльная роза; работающий состав; регулирует потоотделение; резкие ноты; ровный цвет лица; рыжий отлив; с подводкой; с роликами; синяя паста; скатывается первые полчаса; смывается водой; сомнения в оригинале; спрей; средней плотности; стимулирует рост; странная отдушка; сухие патчи; сходство с молекулой; сыплются; сыпучий; тканевые; толстые; тоник с отдушкой; требуется разведение; удобство дозирования; укрывистый; умеренное пенообразование; умывалка в наборе; успокаивающий; хранить в холодильнике; цвета на каждый день; частично заполнен; частичное удаление волос; часто требует обновления; шариковая форма; шелушения исчезли; шиммер; широкая головка; щёточка разъединяет; эффект ламинирования; эффект тинта"
Clothes,базовая; без лямок; оптимальный крой; сохраняет форму после стирки; полная длина; дышащие; идеальная посадка; легкие; компактные; мягкий; износостойкий; нежное; свободный крой; эластичные; плотная ткань; приятный хлопок; синтетика; тонкая ткань; аккуратные детали; бесшовные; боковые карманы; вызывает потоотделение; дискомфорт при ходьбе; для высокого роста; для ежедневной носки; долгоносящиеся; зазор при сидении; извлекаемые вкладыши; качественный принт; колени быстро стираются; крепкая пуговица; летние; льняные; молочный цвет; на резинке; немного клеш; неплотная структура; непросвечивающая; оверсайз; однотонные; плавная молния; плохо пропускает воздух; под пальто; подчеркивает декольте; прорезиненная штучка; просвечивает; прочные; скатываются; тесноваты в талии; узкая ластовица; фактурная ткань; хлопковая; цвет слоновая кость; широкие штанины
